{
  "$schema": "http://json-schema.org/draft-07/schema#",
  "$id": "https://pentest-lyan/state.schema.json",
  "title": "state.json",
  "description": "Stores only workflow cursors and project-level metadata. module_queue.json is the sole source of module-completion state, and sessions/account_*.json is the sole source of session state.",
  "type": "object",
  "additionalProperties": false,
  "required": [
    "base_url",
    "scope",
    "current_phase",
    "scan_start_time"
  ],
  "properties": {
    "base_url": {
      "$ref": "common.schema.json#/definitions/absolute_uri"
    },
    "current_phase": {
      "type": "integer",
      "enum": [
        1,
        2,
        3
      ]
    },
    "current_module": {
      "type": [
        "string",
        "null"
      ]
    },
    "scan_start_time": {
      "$ref": "common.schema.json#/definitions/date_time"
    },
    "registration_page": {
      "oneOf": [
        {
          "$ref": "common.schema.json#/definitions/absolute_uri"
        },
        {
          "type": "null"
        }
      ],
      "description": "Registration-page URL discovered by Discovery; null when none is found."
    },
    "project_id": {
      "$ref": "common.schema.json#/definitions/project_id",
      "description": "Corresponds to the pentest-data/{project_id}/ directory."
    },
    "scope": {
      "type": "object",
      "additionalProperties": false,
      "required": [
        "allowed_origins",
        "excluded_url_prefixes"
      ],
      "properties": {
        "allowed_origins": {
          "type": "array",
          "minItems": 1,
          "uniqueItems": true,
          "items": {
            "$ref": "common.schema.json#/definitions/http_origin"
          },
          "description": "Exact origins explicitly supplied by the user as authorized targets. The base_url origin must be present."
        },
        "excluded_url_prefixes": {
          "type": "array",
          "uniqueItems": true,
          "items": {
            "$ref": "common.schema.json#/definitions/absolute_uri"
          },
          "description": "Optional in-origin URL prefixes explicitly excluded by the user. Exclusions override allowed origins."
        },
        "notes": {
          "type": "string",
          "minLength": 1
        }
      },
      "description": "The user-defined authorization scope. Do not infer sibling subdomains or unrelated third-party origins."
    }
  }
}
