{
  "project_id": "valid-project",
  "base_url": "https://target.example.com",
  "scope": {
    "allowed_origins": [
      "https://target.example.com"
    ],
    "excluded_url_prefixes": []
  },
  "current_phase": 3,
  "current_module": null,
  "scan_start_time": "2026-07-12T09:00:00+08:00",
  "registration_page": null
}
